{
  "task_id": "C001-valid-complete-validation",
  "action": {
    "changes_reality": true,
    "proof_defined": true
  },
  "capability": {
    "sourcing_required": true,
    "single_obvious_source": false,
    "source_selected": "existing-library",
    "source_classes_considered": [
      "internal",
      "library"
    ]
  },
  "evidence": [
    {
      "id": "EV-1",
      "state": "VERIFIED",
      "kind": "validation",
      "source_type": "observed",
      "provenance": "real-user-observation",
      "decision_relevant": true,
      "resolved": true
    }
  ],
  "completion": {
    "claimed": true,
    "proof_type": "VALIDATION_PASS",
    "validation_required": true,
    "validation_observed": true,
    "outcome_validated": true
  }
}
